PS C:\Users\Lenovo> mysql -u root -p
Enter password: ****
Welcome to the MySQL monitor.  Commands end with ; or \g.
Your MySQL connection id is 19
Server version: 8.0.33 MySQL Community Server - GPL

Copyright (c) 2000, 2023, Oracle and/or its affiliates.

Oracle is a registered trademark of Oracle Corporation and/or its
affiliates. Other names may be trademarks of their respective
owners.

Type 'help;' or '\h' for help. Type '\c' to clear the current input statement.

mysql> SHOW DATABASES
    -> ;
+--------------------+
| Database           |
+--------------------+
| information_schema |
| mysql              |
| performance_schema |
| sakila             |
| sys                |
| world              |
+--------------------+
6 rows in set (0.01 sec)

mysql> CREATE DATABASE appsalon;
Query OK, 1 row affected (0.03 sec)

mysql> SHOW DATABASES
    -> ;
+--------------------+
| Database           |
+--------------------+
| appsalon           |
| information_schema |
| mysql              |
| performance_schema |
| sakila             |
| sys                |
| world              |
+--------------------+
7 rows in set (0.00 sec)

mysql> USE appsalon
Database changed
mysql> CREATE TABLE servicios (
    -> id INT(11) NOT NULL AUTO_INCREMENT,
    -> nombre VARCHAR(60) NOT NULL,
    -> precio DECIMAL(6,2) NOT NULL,
    -> PRIMARY KEY(id)
    -> );
Query OK, 0 rows affected, 1 warning (0.05 sec)

mysql> SHOW TABLES;
+--------------------+
| Tables_in_appsalon |
+--------------------+
| servicios          |
+--------------------+
1 row in set (0.04 sec)

mysql> DESCRIBE servicios
    -> ;
+--------+--------------+------+-----+---------+----------------+
| Field  | Type         | Null | Key | Default | Extra          |
+--------+--------------+------+-----+---------+----------------+
| id     | int          | NO   | PRI | NULL    | auto_increment |
| nombre | varchar(60)  | NO   |     | NULL    |                |
| precio | decimal(6,2) | NO   |     | NULL    |                |
+--------+--------------+------+-----+---------+----------------+
3 rows in set (0.03 sec)

mysql> INSERT INTO servicios (nombre, precio) VALUES ("Corte de cabello de Adulto",80);
Query OK, 1 row affected (0.02 sec)

mysql> INSERT INTO servicios (nombre, precio) VALUES ("Corte de cabello de Niño",60);
Query OK, 1 row affected (0.02 sec)

mysql> INSERT INTO servicios (nombre,precio) VALUES ("Pintado de pelo", 70);
Query OK, 1 row affected (0.02 sec)

mysql> INSERT INTO servicios (nombre,precio) VALUES
    -> ("Peinado de mujer",80),
    -> ("Peinado de hombre",60);
Query OK, 2 rows affected (0.02 sec)
Records: 2  Duplicates: 0  Warnings: 0

mysql> SELECT * FROM servicios;
+----+----------------------------+--------+
| id | nombre                     | precio |
+----+----------------------------+--------+
|  1 | Corte de cabello de Adulto |  80.00 |
|  2 | Corte de cabello de Niño   |  60.00 |
|  3 | Pintado de pelo            |  70.00 |
|  4 | Peinado de mujer           |  80.00 |
|  5 | Peinado de hombre          |  60.00 |
+----+----------------------------+--------+
5 rows in set (0.01 sec)

mysql> SELECT nombre FROM servicios;
+----------------------------+
| nombre                     |
+----------------------------+
| Corte de cabello de Adulto |
| Corte de cabello de Niño   |
| Pintado de pelo            |
| Peinado de mujer           |
| Peinado de hombre          |
+----------------------------+
5 rows in set (0.00 sec)

mysql> SELECT nombre,precio FROM servicios;
+----------------------------+--------+
| nombre                     | precio |
+----------------------------+--------+
| Corte de cabello de Adulto |  80.00 |
| Corte de cabello de Niño   |  60.00 |
| Pintado de pelo            |  70.00 |
| Peinado de mujer           |  80.00 |
| Peinado de hombre          |  60.00 |
+----------------------------+--------+
5 rows in set (0.00 sec)

mysql> SELECT id,nombre,precio FROM servicios
    -> ;
+----+----------------------------+--------+
| id | nombre                     | precio |
+----+----------------------------+--------+
|  1 | Corte de cabello de Adulto |  80.00 |
|  2 | Corte de cabello de Niño   |  60.00 |
|  3 | Pintado de pelo            |  70.00 |
|  4 | Peinado de mujer           |  80.00 |
|  5 | Peinado de hombre          |  60.00 |
+----+----------------------------+--------+
5 rows in set (0.00 sec)

mysql> SELECT id,nombre,precio FROM servicios ORDER BY precio;
+----+----------------------------+--------+
| id | nombre                     | precio |
+----+----------------------------+--------+
|  2 | Corte de cabello de Niño   |  60.00 |
|  5 | Peinado de hombre          |  60.00 |
|  3 | Pintado de pelo            |  70.00 |
|  1 | Corte de cabello de Adulto |  80.00 |
|  4 | Peinado de mujer           |  80.00 |
+----+----------------------------+--------+
5 rows in set (0.00 sec)

mysql> SELECT id,nombre,precio FROM servicios ORDER BY precio DESC;
+----+----------------------------+--------+
| id | nombre                     | precio |
+----+----------------------------+--------+
|  1 | Corte de cabello de Adulto |  80.00 |
|  4 | Peinado de mujer           |  80.00 |
|  3 | Pintado de pelo            |  70.00 |
|  2 | Corte de cabello de Niño   |  60.00 |
|  5 | Peinado de hombre          |  60.00 |
+----+----------------------------+--------+
5 rows in set (0.00 sec)

mysql> SELECT id,nombre,precio FROM servicios ORDER BY id DESC;
+----+----------------------------+--------+
| id | nombre                     | precio |
+----+----------------------------+--------+
|  5 | Peinado de hombre          |  60.00 |
|  4 | Peinado de mujer           |  80.00 |
|  3 | Pintado de pelo            |  70.00 |
|  2 | Corte de cabello de Niño   |  60.00 |
|  1 | Corte de cabello de Adulto |  80.00 |
+----+----------------------------+--------+
5 rows in set (0.00 sec)

mysql> SELECT * FROM servicios LIMIT 2;
+----+----------------------------+--------+
| id | nombre                     | precio |
+----+----------------------------+--------+
|  1 | Corte de cabello de Adulto |  80.00 |
|  2 | Corte de cabello de Niño   |  60.00 |
+----+----------------------------+--------+
2 rows in set (0.00 sec)

mysql> SELECT * FROM servicios ORDER BY id DESC LIMIT 2;
+----+-------------------+--------+
| id | nombre            | precio |
+----+-------------------+--------+
|  5 | Peinado de hombre |  60.00 |
|  4 | Peinado de mujer  |  80.00 |
+----+-------------------+--------+
2 rows in set (0.00 sec)

mysql> SELECT * FROM servicios WHERE id = 3;
+----+-----------------+--------+
| id | nombre          | precio |
+----+-----------------+--------+
|  3 | Pintado de pelo |  70.00 |
+----+-----------------+--------+
1 row in set (0.00 sec)

mysql> SELECT * FROM servicios
    -> ;
+----+----------------------------+--------+
| id | nombre                     | precio |
+----+----------------------------+--------+
|  1 | Corte de cabello de Adulto |  80.00 |
|  2 | Corte de cabello de Niño   |  60.00 |
|  3 | Pintado de pelo            |  70.00 |
|  4 | Peinado de mujer           |  80.00 |
|  5 | Peinado de hombre          |  60.00 |
+----+----------------------------+--------+
5 rows in set (0.00 sec)

mysql> UPDATE servicios SET precio = 70 WHERE id = 2;
Query OK, 1 row affected (0.02 sec)
Rows matched: 1  Changed: 1  Warnings: 0

mysql> SELECT * FROM servicios;
+----+----------------------------+--------+
| id | nombre                     | precio |
+----+----------------------------+--------+
|  1 | Corte de cabello de Adulto |  80.00 |
|  2 | Corte de cabello de Niño   |  70.00 |
|  3 | Pintado de pelo            |  70.00 |
|  4 | Peinado de mujer           |  80.00 |
|  5 | Peinado de hombre          |  60.00 |
+----+----------------------------+--------+
5 rows in set (0.00 sec)

mysql> UPDATE servicios SET nombre = "Nuevo corte de cabello de Niño " WHERE id = 2;
Query OK, 1 row affected (0.01 sec)
Rows matched: 1  Changed: 1  Warnings: 0

mysql> SELECT * FROM servicios;
+----+---------------------------------+--------+
| id | nombre                          | precio |
+----+---------------------------------+--------+
|  1 | Corte de cabello de Adulto      |  80.00 |
|  2 | Nuevo corte de cabello de Niño  |  70.00 |
|  3 | Pintado de pelo                 |  70.00 |
|  4 | Peinado de mujer                |  80.00 |
|  5 | Peinado de hombre               |  60.00 |
+----+---------------------------------+--------+
5 rows in set (0.00 sec)

mysql> UPDATE servicios SET nombre = "Corte de cabello militar", precio = 40 WHERE id = 2;
Query OK, 1 row affected (0.01 sec)
Rows matched: 1  Changed: 1  Warnings: 0

mysql> SELECT * FROM servicios;
+----+----------------------------+--------+
| id | nombre                     | precio |
+----+----------------------------+--------+
|  1 | Corte de cabello de Adulto |  80.00 |
|  2 | Corte de cabello militar   |  40.00 |
|  3 | Pintado de pelo            |  70.00 |
|  4 | Peinado de mujer           |  80.00 |
|  5 | Peinado de hombre          |  60.00 |
+----+----------------------------+--------+
5 rows in set (0.00 sec)

mysql> DELETE FROM servicios  WHERE id=1;
Query OK, 1 row affected (0.01 sec)

mysql> DELETE FROM servicios  WHERE id=5;
Query OK, 1 row affected (0.02 sec)

mysql> SELECT * FROM servicios;
+----+--------------------------+--------+
| id | nombre                   | precio |
+----+--------------------------+--------+
|  2 | Corte de cabello militar |  40.00 |
|  3 | Pintado de pelo          |  70.00 |
|  4 | Peinado de mujer         |  80.00 |
+----+--------------------------+--------+
3 rows in set (0.00 sec)

mysql> INSERT INTO servicios (nombre,precio) VALUES ("Corte de cabello adulto",90);
Query OK, 1 row affected (0.02 sec)

mysql> SELECT * FROM servicios;
+----+--------------------------+--------+
| id | nombre                   | precio |
+----+--------------------------+--------+
|  2 | Corte de cabello militar |  40.00 |
|  3 | Pintado de pelo          |  70.00 |
|  4 | Peinado de mujer         |  80.00 |
|  6 | Corte de cabello adulto  |  90.00 |
+----+--------------------------+--------+
4 rows in set (0.00 sec)

mysql> DESCRIBE servicios;
+--------+--------------+------+-----+---------+----------------+
| Field  | Type         | Null | Key | Default | Extra          |
+--------+--------------+------+-----+---------+----------------+
| id     | int          | NO   | PRI | NULL    | auto_increment |
| nombre | varchar(60)  | NO   |     | NULL    |                |
| precio | decimal(6,2) | NO   |     | NULL    |                |
+--------+--------------+------+-----+---------+----------------+
3 rows in set (0.00 sec)

mysql> ALTER TABLE servicios ADD descripcion VARCHAR(100) NOT NULL;
Query OK, 0 rows affected (0.04 sec)
Records: 0  Duplicates: 0  Warnings: 0

mysql> DESCRIBE servicios;
+-------------+--------------+------+-----+---------+----------------+
| Field       | Type         | Null | Key | Default | Extra          |
+-------------+--------------+------+-----+---------+----------------+
| id          | int          | NO   | PRI | NULL    | auto_increment |
| nombre      | varchar(60)  | NO   |     | NULL    |                |
| precio      | decimal(6,2) | NO   |     | NULL    |                |
| descripcion | varchar(100) | NO   |     | NULL    |                |
+-------------+--------------+------+-----+---------+----------------+
4 rows in set (0.01 sec)

mysql> SELECT * FROM servicios;
+----+--------------------------+--------+-------------+
| id | nombre                   | precio | descripcion |
+----+--------------------------+--------+-------------+
|  2 | Corte de cabello militar |  40.00 |             |
|  3 | Pintado de pelo          |  70.00 |             |
|  4 | Peinado de mujer         |  80.00 |             |
|  6 | Corte de cabello adulto  |  90.00 |             |
+----+--------------------------+--------+-------------+
4 rows in set (0.00 sec)

mysql> ALTER TABLE servicios CHANGE descripcion nuevonombre INT(11) NOT NULL;
ERROR 1366 (HY000): Incorrect integer value: '' for column 'nuevonombre' at row 1
mysql> ALTER TABLE servicios CHANGE descripcion nuevonombre VARCHAR(11) NOT NULL;
Query OK, 4 rows affected (0.07 sec)
Records: 4  Duplicates: 0  Warnings: 0

mysql> DESCRIBE servicios;
+-------------+--------------+------+-----+---------+----------------+
| Field       | Type         | Null | Key | Default | Extra          |
+-------------+--------------+------+-----+---------+----------------+
| id          | int          | NO   | PRI | NULL    | auto_increment |
| nombre      | varchar(60)  | NO   |     | NULL    |                |
| precio      | decimal(6,2) | NO   |     | NULL    |                |
| nuevonombre | varchar(11)  | NO   |     | NULL    |                |
+-------------+--------------+------+-----+---------+----------------+
4 rows in set (0.00 sec)

mysql>  INSERT INTO servicios (nombre,precio,nuevonombre) VALUES ("Uñas", 120, "Info");
Query OK, 1 row affected (0.00 sec)

mysql> SELECT * FROM servicios;
+----+--------------------------+--------+-------------+
| id | nombre                   | precio | nuevonombre |
+----+--------------------------+--------+-------------+
|  2 | Corte de cabello militar |  40.00 |             |
|  3 | Pintado de pelo          |  70.00 |             |
|  4 | Peinado de mujer         |  80.00 |             |
|  6 | Corte de cabello adulto  |  90.00 |             |
|  7 | Uñas                     | 120.00 | Info        |
+----+--------------------------+--------+-------------+
5 rows in set (0.00 sec)

mysql> ALTER TABLE servicios CHANGE nuevonombre descripcion INT(11) NOT NULL;
ERROR 1366 (HY000): Incorrect integer value: '' for column 'descripcion' at row 1
mysql> ALTER TABLE servicios CHANGE nuevonombre descripcion VARCHAR(11) NOT NULL;
Query OK, 0 rows affected (0.03 sec)
Records: 0  Duplicates: 0  Warnings: 0

mysql> SELECT * FROM servicios;
+----+--------------------------+--------+-------------+
| id | nombre                   | precio | descripcion |
+----+--------------------------+--------+-------------+
|  2 | Corte de cabello militar |  40.00 |             |
|  3 | Pintado de pelo          |  70.00 |             |
|  4 | Peinado de mujer         |  80.00 |             |
|  6 | Corte de cabello adulto  |  90.00 |             |
|  7 | Uñas                     | 120.00 | Info        |
+----+--------------------------+--------+-------------+
5 rows in set (0.00 sec)

mysql> ALTER TABLE servicios DROP COLUMN descripcion;
Query OK, 0 rows affected (0.03 sec)
Records: 0  Duplicates: 0  Warnings: 0

mysql> SELECT * FROM servicios;
+----+--------------------------+--------+
| id | nombre                   | precio |
+----+--------------------------+--------+
|  2 | Corte de cabello militar |  40.00 |
|  3 | Pintado de pelo          |  70.00 |
|  4 | Peinado de mujer         |  80.00 |
|  6 | Corte de cabello adulto  |  90.00 |
|  7 | Uñas                     | 120.00 |
+----+--------------------------+--------+
5 rows in set (0.00 sec)


mysql> SHOW TABLES;
+--------------------+
| Tables_in_appsalon |
+--------------------+
| servicios          |
+--------------------+
1 row in set (0.02 sec)

mysql> DROP TABLE servicios;
Query OK, 0 rows affected (0.05 sec)

mysql> SHOW TABLES;
Empty set (0.02 sec)

mysql> CREATE TABLE servicios (
    -> id INT NOT NULL AUTO_INCREMENT,
    -> nombre VARCHAR(60) NOT NULL,
    -> precio DECIMAL(6,2) NOT NULL,
    -> PRIMARY KEY (id)
    -> );
Query OK, 0 rows affected (0.06 sec)

mysql> SHOW TABLES;
+--------------------+
| Tables_in_appsalon |
+--------------------+
| servicios          |
+--------------------+
1 row in set (0.00 sec)

mysql> DESCRIBE servicios;
+--------+--------------+------+-----+---------+----------------+
| Field  | Type         | Null | Key | Default | Extra          |
+--------+--------------+------+-----+---------+----------------+
| id     | int          | NO   | PRI | NULL    | auto_increment |
| nombre | varchar(60)  | NO   |     | NULL    |                |
| precio | decimal(6,2) | NO   |     | NULL    |                |
+--------+--------------+------+-----+---------+----------------+
3 rows in set (0.02 sec)

mysql> CREATE TABLE reservaciones(
    -> id INT(11) NOT NULL AUTO_INCREMENT,
    -> nombre VARCHAR(60) NOT NULL,
    -> apellido VARCHAR(60) NOT NULL,
    -> hora TIME DEFAULT NULL,
    -> fecha DATE DEFAULT NULL,
    -> servicios VARCHAR(255) NOT NULL,
    -> PRIMARY KEY (id)
    -> );
Query OK, 0 rows affected, 1 warning (0.04 sec)

mysql> SHOW TABLES;
+--------------------+
| Tables_in_appsalon |
+--------------------+
| reservaciones      |
| servicios          |
+--------------------+
2 rows in set (0.00 sec)

mysql> DESCRIBE reservaciones
    -> ;
+-----------+--------------+------+-----+---------+----------------+
| Field     | Type         | Null | Key | Default | Extra          |
+-----------+--------------+------+-----+---------+----------------+
| id        | int          | NO   | PRI | NULL    | auto_increment |
| nombre    | varchar(60)  | NO   |     | NULL    |                |
| apellido  | varchar(60)  | NO   |     | NULL    |                |
| hora      | time         | YES  |     | NULL    |                |
| fecha     | date         | YES  |     | NULL    |                |
| servicios | varchar(255) | NO   |     | NULL    |                |
+-----------+--------------+------+-----+---------+----------------+
6 rows in set (0.00 sec)

mysql> INSERT INTO reservaciones (nombre, apellido, hora, fecha, servicios) VALUES
    ->         ('Juan', 'De la torre', '10:30:00', '2021-06-28', 'Corte de Cabello Adulto, Corte de Barba' ),
    ->         ('Antonio', 'Hernandez', '14:00:00', '2021-07-30', 'Corte de Cabello Niño'),
    ->         ('Pedro', 'Juarez', '20:00:00', '2021-06-25', 'Corte de Cabello Adulto'),
    ->         ('Mireya', 'Perez', '19:00:00', '2021-06-25', 'Peinado Mujer'),
    ->         ('Jose', 'Castillo', '14:00:00', '2021-07-30', 'Peinado Hombre'),
    ->         ('Maria', 'Diaz', '14:30:00', '2021-06-25', 'Tinte'),
    ->         ('Clara', 'Duran', '10:00:00', '2021-07-01', 'Uñas, Tinte, Corte de Cabello Mujer'),
    ->         ('Miriam', 'Ibañez', '09:00:00', '2021-07-01', 'Tinte'),
    ->         ('Samuel', 'Reyes', '10:00:00', '2021-07-02', 'Tratamiento Capilar'),
    ->         ('Joaquin', 'Muñoz', '19:00:00', '2021-06-28', 'Tratamiento Capilar'),
    ->         ('Julia', 'Lopez', '08:00:00', '2021-06-25', 'Tinte'),
    ->         ('Carmen', 'Ruiz', '20:00:00', '2021-07-01', 'Uñas'),
    ->         ('Isaac', 'Sala', '09:00:00', '2021-07-30', 'Corte de Cabello Adulto'),
    ->         ('Ana', 'Preciado', '14:30:00', '2021-06-28', 'Corte de Cabello Mujer'),
    ->         ('Sergio', 'Iglesias', '10:00:00', '2021-07-02', 'Corte de Cabello Adulto'),
    ->         ('Aina', 'Acosta', '14:00:00', '2021-07-30', 'Uñas'),
    ->         ('Carlos', 'Ortiz', '20:00:00', '2021-06-25', 'Corte de Cabello Niño'),
    ->         ('Roberto', 'Serrano', '10:00:00', '2021-07-30', 'Corte de Cabello Niño'),
    ->         ('Carlota', 'Perez', '14:00:00', '2021-07-01', 'Uñas'),
    ->         ('Ana Maria', 'Igleias', '14:00:00', '2021-07-02', 'Uñas, Tinte'),
    ->         ('Jaime', 'Jimenez', '14:00:00', '2021-07-01', 'Corte de Cabello Niño'),
    ->         ('Roberto', 'Torres', '10:00:00', '2021-07-02', 'Corte de Cabello Adulto'),
    ->         ('Juan', 'Cano', '09:00:00', '2021-07-02', 'Corte de Cabello Niño'),
    ->         ('Santiago', 'Hernandez', '19:00:00', '2021-06-28', 'Corte de Cabello Niño'),
    ->         ('Berta', 'Gomez', '09:00:00', '2021-07-01', 'Uñas'),
    ->         ('Miriam', 'Dominguez', '19:00:00', '2021-06-28', 'Corte de Cabello Niño'),
    ->         ('Antonio', 'Castro', '14:30:00', '2021-07-02', 'Corte de Cabello Adulti'),
    ->         ('Hugo', 'Alonso', '09:00:00', '2021-06-28', 'Corte de Barba'),
    ->         ('Victoria', 'Perez', '10:00:00', '2021-07-02', 'Uñas, Tinte'),
    ->         ('Jimena', 'Leon', '10:30:00', '2021-07-30', 'Uñas, Corte de Cabello Mujer'),
    ->         ('Raquel' ,'Peña', '20:30:00', '2021-06-25', 'Corte de Cabello Mujer');
Query OK, 31 rows affected (0.02 sec)
Records: 31  Duplicates: 0  Warnings: 0

mysql> INSERT INTO servicios ( nombre, precio ) VALUES
    ->         ('Corte de Cabello Niño', 60),
    ->         ('Corte de Cabello Hombre', 80),
    ->         ('Corte de Barba', 60),
    ->         ('Peinado Mujer', 80),
    ->         ('Peinado Hombre', 60),
    ->         ('Tinte',300),
    ->         ('Uñas', 400),
    ->         ('Lavado de Cabello', 50),
    ->         ('Tratamiento Capilar', 150);
Query OK, 9 rows affected (0.02 sec)
Records: 9  Duplicates: 0  Warnings: 0

mysql> SELECT * FROM servicios;
+----+-------------------------+--------+
| id | nombre                  | precio |
+----+-------------------------+--------+
|  1 | Corte de Cabello Niño   |  60.00 |
|  2 | Corte de Cabello Hombre |  80.00 |
|  3 | Corte de Barba          |  60.00 |
|  4 | Peinado Mujer           |  80.00 |
|  5 | Peinado Hombre          |  60.00 |
|  6 | Tinte                   | 300.00 |
|  7 | Uñas                    | 400.00 |
|  8 | Lavado de Cabello       |  50.00 |
|  9 | Tratamiento Capilar     | 150.00 |
+----+-------------------------+--------+
9 rows in set (0.02 sec)

mysql> SELECT * FROM servicios WHERE precio > 90;
+----+---------------------+--------+
| id | nombre              | precio |
+----+---------------------+--------+
|  6 | Tinte               | 300.00 |
|  7 | Uñas                | 400.00 |
|  9 | Tratamiento Capilar | 150.00 |
+----+---------------------+--------+
3 rows in set (0.02 sec)

mysql> SELECT * FROM servicios WHERE precio > 80;
+----+---------------------+--------+
| id | nombre              | precio |
+----+---------------------+--------+
|  6 | Tinte               | 300.00 |
|  7 | Uñas                | 400.00 |
|  9 | Tratamiento Capilar | 150.00 |
+----+---------------------+--------+
3 rows in set (0.00 sec)

mysql> SELECT * FROM servicios WHERE precio >= 80;
+----+-------------------------+--------+
| id | nombre                  | precio |
+----+-------------------------+--------+
|  2 | Corte de Cabello Hombre |  80.00 |
|  4 | Peinado Mujer           |  80.00 |
|  6 | Tinte                   | 300.00 |
|  7 | Uñas                    | 400.00 |
|  9 | Tratamiento Capilar     | 150.00 |
+----+-------------------------+--------+
5 rows in set (0.00 sec)

mysql> SELECT * FROM servicios WHERE precio = 80;
+----+-------------------------+--------+
| id | nombre                  | precio |
+----+-------------------------+--------+
|  2 | Corte de Cabello Hombre |  80.00 |
|  4 | Peinado Mujer           |  80.00 |
+----+-------------------------+--------+
2 rows in set (0.00 sec)

mysql> SELECT * FROM servicios WHERE precio BETWEEN 100 AND 200;
+----+---------------------+--------+
| id | nombre              | precio |
+----+---------------------+--------+
|  9 | Tratamiento Capilar | 150.00 |
+----+---------------------+--------+
1 row in set (0.02 sec)

mysql> SELECT * FROM reservaciones;
+----+-----------+-------------+----------+------------+-----------------------------------------+
| id | nombre    | apellido    | hora     | fecha      | servicios                               |
+----+-----------+-------------+----------+------------+-----------------------------------------+
|  1 | Juan      | De la torre | 10:30:00 | 2021-06-28 | Corte de Cabello Adulto, Corte de Barba |
|  2 | Antonio   | Hernandez   | 14:00:00 | 2021-07-30 | Corte de Cabello Niño                   |
|  3 | Pedro     | Juarez      | 20:00:00 | 2021-06-25 | Corte de Cabello Adulto                 |
|  4 | Mireya    | Perez       | 19:00:00 | 2021-06-25 | Peinado Mujer                           |
|  5 | Jose      | Castillo    | 14:00:00 | 2021-07-30 | Peinado Hombre                          |
|  6 | Maria     | Diaz        | 14:30:00 | 2021-06-25 | Tinte                                   |
|  7 | Clara     | Duran       | 10:00:00 | 2021-07-01 | Uñas, Tinte, Corte de Cabello Mujer     |
|  8 | Miriam    | Ibañez      | 09:00:00 | 2021-07-01 | Tinte                                   |
|  9 | Samuel    | Reyes       | 10:00:00 | 2021-07-02 | Tratamiento Capilar                     |
| 10 | Joaquin   | Muñoz       | 19:00:00 | 2021-06-28 | Tratamiento Capilar                     |
| 11 | Julia     | Lopez       | 08:00:00 | 2021-06-25 | Tinte                                   |
| 12 | Carmen    | Ruiz        | 20:00:00 | 2021-07-01 | Uñas                                    |
| 13 | Isaac     | Sala        | 09:00:00 | 2021-07-30 | Corte de Cabello Adulto                 |
| 14 | Ana       | Preciado    | 14:30:00 | 2021-06-28 | Corte de Cabello Mujer                  |
| 15 | Sergio    | Iglesias    | 10:00:00 | 2021-07-02 | Corte de Cabello Adulto                 |
| 16 | Aina      | Acosta      | 14:00:00 | 2021-07-30 | Uñas                                    |
| 17 | Carlos    | Ortiz       | 20:00:00 | 2021-06-25 | Corte de Cabello Niño                   |
| 18 | Roberto   | Serrano     | 10:00:00 | 2021-07-30 | Corte de Cabello Niño                   |
| 19 | Carlota   | Perez       | 14:00:00 | 2021-07-01 | Uñas                                    |
| 20 | Ana Maria | Igleias     | 14:00:00 | 2021-07-02 | Uñas, Tinte                             |
| 21 | Jaime     | Jimenez     | 14:00:00 | 2021-07-01 | Corte de Cabello Niño                   |
| 22 | Roberto   | Torres      | 10:00:00 | 2021-07-02 | Corte de Cabello Adulto                 |
| 23 | Juan      | Cano        | 09:00:00 | 2021-07-02 | Corte de Cabello Niño                   |
| 24 | Santiago  | Hernandez   | 19:00:00 | 2021-06-28 | Corte de Cabello Niño                   |
| 25 | Berta     | Gomez       | 09:00:00 | 2021-07-01 | Uñas                                    |
| 26 | Miriam    | Dominguez   | 19:00:00 | 2021-06-28 | Corte de Cabello Niño                   |
| 27 | Antonio   | Castro      | 14:30:00 | 2021-07-02 | Corte de Cabello Adulti                 |
| 28 | Hugo      | Alonso      | 09:00:00 | 2021-06-28 | Corte de Barba                          |
| 29 | Victoria  | Perez       | 10:00:00 | 2021-07-02 | Uñas, Tinte                             |
| 30 | Jimena    | Leon        | 10:30:00 | 2021-07-30 | Uñas, Corte de Cabello Mujer            |
| 31 | Raquel    | Peña        | 20:30:00 | 2021-06-25 | Corte de Cabello Mujer                  |
+----+-----------+-------------+----------+------------+-----------------------------------------+
31 rows in set (0.00 sec)

mysql> SELECT COUNT(id), fecha
    -> FROM reservaciones
    -> GROUP BY fecha
    -> ORDER BY COUNT(id) DESC;
+-----------+------------+
| COUNT(id) | fecha      |
+-----------+------------+
|         7 | 2021-07-02 |
|         6 | 2021-06-28 |
|         6 | 2021-07-30 |
|         6 | 2021-06-25 |
|         6 | 2021-07-01 |
+-----------+------------+
5 rows in set (0.02 sec)

mysql> SELECT * FROM servicios;
+----+-------------------------+--------+
| id | nombre                  | precio |
+----+-------------------------+--------+
|  1 | Corte de Cabello Niño   |  60.00 |
|  2 | Corte de Cabello Hombre |  80.00 |
|  3 | Corte de Barba          |  60.00 |
|  4 | Peinado Mujer           |  80.00 |
|  5 | Peinado Hombre          |  60.00 |
|  6 | Tinte                   | 300.00 |
|  7 | Uñas                    | 400.00 |
|  8 | Lavado de Cabello       |  50.00 |
|  9 | Tratamiento Capilar     | 150.00 |
+----+-------------------------+--------+
9 rows in set (0.00 sec)

mysql> SELECT SUM(precio) AS totalServicios FROM servicios;
+----------------+
| totalServicios |
+----------------+
|        1240.00 |
+----------------+
1 row in set (0.00 sec)

mysql> SELECT MIN(precio) AS precioMenor FROM servicios;
+-------------+
| precioMenor |
+-------------+
|       50.00 |
+-------------+
1 row in set (0.02 sec)

mysql> SELECT * FROM servicios;
+----+-------------------------+--------+
| id | nombre                  | precio |
+----+-------------------------+--------+
|  1 | Corte de Cabello Niño   |  60.00 |
|  2 | Corte de Cabello Hombre |  80.00 |
|  3 | Corte de Barba          |  60.00 |
|  4 | Peinado Mujer           |  80.00 |
|  5 | Peinado Hombre          |  60.00 |
|  6 | Tinte                   | 300.00 |
|  7 | Uñas                    | 400.00 |
|  8 | Lavado de Cabello       |  50.00 |
|  9 | Tratamiento Capilar     | 150.00 |
+----+-------------------------+--------+
9 rows in set (0.00 sec)

mysql> SELECT * FROM servicios WHERE nombre LIKE "Corte%";
+----+-------------------------+--------+
| id | nombre                  | precio |
+----+-------------------------+--------+
|  1 | Corte de Cabello Niño   |  60.00 |
|  2 | Corte de Cabello Hombre |  80.00 |
|  3 | Corte de Barba          |  60.00 |
+----+-------------------------+--------+
3 rows in set (0.01 sec)

mysql> SELECT * FROM servicios WHERE nombre LIKE "Peinado%";
+----+----------------+--------+
| id | nombre         | precio |
+----+----------------+--------+
|  4 | Peinado Mujer  |  80.00 |
|  5 | Peinado Hombre |  60.00 |
+----+----------------+--------+
2 rows in set (0.00 sec)

mysql> SELECT * FROM servicios WHERE nombre LIKE "%Peinado";
Empty set (0.00 sec)

mysql> SELECT * FROM servicios WHERE nombre LIKE "%Mujer";
+----+---------------+--------+
| id | nombre        | precio |
+----+---------------+--------+
|  4 | Peinado Mujer |  80.00 |
+----+---------------+--------+
1 row in set (0.00 sec)

mysql> SELECT * FROM servicios WHERE nombre LIKE "%de%";
+----+-------------------------+--------+
| id | nombre                  | precio |
+----+-------------------------+--------+
|  1 | Corte de Cabello Niño   |  60.00 |
|  2 | Corte de Cabello Hombre |  80.00 |
|  3 | Corte de Barba          |  60.00 |
|  8 | Lavado de Cabello       |  50.00 |
+----+-------------------------+--------+
4 rows in set (0.00 sec)

mysql> SELECT * FROM reservaciones
    -> ;
+----+-----------+-------------+----------+------------+-----------------------------------------+
| id | nombre    | apellido    | hora     | fecha      | servicios                               |
+----+-----------+-------------+----------+------------+-----------------------------------------+
|  1 | Juan      | De la torre | 10:30:00 | 2021-06-28 | Corte de Cabello Adulto, Corte de Barba |
|  2 | Antonio   | Hernandez   | 14:00:00 | 2021-07-30 | Corte de Cabello Niño                   |
|  3 | Pedro     | Juarez      | 20:00:00 | 2021-06-25 | Corte de Cabello Adulto                 |
|  4 | Mireya    | Perez       | 19:00:00 | 2021-06-25 | Peinado Mujer                           |
|  5 | Jose      | Castillo    | 14:00:00 | 2021-07-30 | Peinado Hombre                          |
|  6 | Maria     | Diaz        | 14:30:00 | 2021-06-25 | Tinte                                   |
|  7 | Clara     | Duran       | 10:00:00 | 2021-07-01 | Uñas, Tinte, Corte de Cabello Mujer     |
|  8 | Miriam    | Ibañez      | 09:00:00 | 2021-07-01 | Tinte                                   |
|  9 | Samuel    | Reyes       | 10:00:00 | 2021-07-02 | Tratamiento Capilar                     |
| 10 | Joaquin   | Muñoz       | 19:00:00 | 2021-06-28 | Tratamiento Capilar                     |
| 11 | Julia     | Lopez       | 08:00:00 | 2021-06-25 | Tinte                                   |
| 12 | Carmen    | Ruiz        | 20:00:00 | 2021-07-01 | Uñas                                    |
| 13 | Isaac     | Sala        | 09:00:00 | 2021-07-30 | Corte de Cabello Adulto                 |
| 14 | Ana       | Preciado    | 14:30:00 | 2021-06-28 | Corte de Cabello Mujer                  |
| 15 | Sergio    | Iglesias    | 10:00:00 | 2021-07-02 | Corte de Cabello Adulto                 |
| 16 | Aina      | Acosta      | 14:00:00 | 2021-07-30 | Uñas                                    |
| 17 | Carlos    | Ortiz       | 20:00:00 | 2021-06-25 | Corte de Cabello Niño                   |
| 18 | Roberto   | Serrano     | 10:00:00 | 2021-07-30 | Corte de Cabello Niño                   |
| 19 | Carlota   | Perez       | 14:00:00 | 2021-07-01 | Uñas                                    |
| 20 | Ana Maria | Igleias     | 14:00:00 | 2021-07-02 | Uñas, Tinte                             |
| 21 | Jaime     | Jimenez     | 14:00:00 | 2021-07-01 | Corte de Cabello Niño                   |
| 22 | Roberto   | Torres      | 10:00:00 | 2021-07-02 | Corte de Cabello Adulto                 |
| 23 | Juan      | Cano        | 09:00:00 | 2021-07-02 | Corte de Cabello Niño                   |
| 24 | Santiago  | Hernandez   | 19:00:00 | 2021-06-28 | Corte de Cabello Niño                   |
| 25 | Berta     | Gomez       | 09:00:00 | 2021-07-01 | Uñas                                    |
| 26 | Miriam    | Dominguez   | 19:00:00 | 2021-06-28 | Corte de Cabello Niño                   |
| 27 | Antonio   | Castro      | 14:30:00 | 2021-07-02 | Corte de Cabello Adulti                 |
| 28 | Hugo      | Alonso      | 09:00:00 | 2021-06-28 | Corte de Barba                          |
| 29 | Victoria  | Perez       | 10:00:00 | 2021-07-02 | Uñas, Tinte                             |
| 30 | Jimena    | Leon        | 10:30:00 | 2021-07-30 | Uñas, Corte de Cabello Mujer            |
| 31 | Raquel    | Peña        | 20:30:00 | 2021-06-25 | Corte de Cabello Mujer                  |
+----+-----------+-------------+----------+------------+-----------------------------------------+
31 rows in set (0.00 sec)

mysql> SELECT CONCAT(nombre, " ", apellido) AS nombreCompleto FROM reservaciones;
+--------------------+
| nombreCompleto     |
+--------------------+
| Juan De la torre   |
| Antonio Hernandez  |
| Pedro Juarez       |
| Mireya Perez       |
| Jose Castillo      |
| Maria Diaz         |
| Clara Duran        |
| Miriam Ibañez      |
| Samuel Reyes       |
| Joaquin Muñoz      |
| Julia Lopez        |
| Carmen Ruiz        |
| Isaac Sala         |
| Ana Preciado       |
| Sergio Iglesias    |
| Aina Acosta        |
| Carlos Ortiz       |
| Roberto Serrano    |
| Carlota Perez      |
| Ana Maria Igleias  |
| Jaime Jimenez      |
| Roberto Torres     |
| Juan Cano          |
| Santiago Hernandez |
| Berta Gomez        |
| Miriam Dominguez   |
| Antonio Castro     |
| Hugo Alonso        |
| Victoria Perez     |
| Jimena Leon        |
| Raquel Peña        |
+--------------------+
31 rows in set (0.00 sec)

mysql> SELECT * FROM reservaciones
    -> WHERE CONCAT(nombre, " ", apellido) LIKE "%Berta Gomez%";
+----+--------+----------+----------+------------+-----------+
| id | nombre | apellido | hora     | fecha      | servicios |
+----+--------+----------+----------+------------+-----------+
| 25 | Berta  | Gomez    | 09:00:00 | 2021-07-01 | Uñas      |
+----+--------+----------+----------+------------+-----------+
1 row in set (0.00 sec)

mysql> SELECT hora, fecha, CONCAT(nombre, "", apellido) as NombreCompleto
    -> FROM reservaciones
    -> WHERE CONCAT(nombre, " ", apellido)
    -> LIKE "%Berta Gomez%";
+----------+------------+----------------+
| hora     | fecha      | NombreCompleto |
+----------+------------+----------------+
| 09:00:00 | 2021-07-01 | BertaGomez     |
+----------+------------+----------------+
1 row in set (0.00 sec)

mysql> SELECT * FROM reservaciones WHERE id IN(1,3);
+----+--------+-------------+----------+------------+-----------------------------------------+
| id | nombre | apellido    | hora     | fecha      | servicios                               |
+----+--------+-------------+----------+------------+-----------------------------------------+
|  1 | Juan   | De la torre | 10:30:00 | 2021-06-28 | Corte de Cabello Adulto, Corte de Barba |
|  3 | Pedro  | Juarez      | 20:00:00 | 2021-06-25 | Corte de Cabello Adulto                 |
+----+--------+-------------+----------+------------+-----------------------------------------+
2 rows in set (0.00 sec)

mysql> SELECT * FROM reservaciones WHERE fecha = "2021-06-28";
+----+----------+-------------+----------+------------+-----------------------------------------+
| id | nombre   | apellido    | hora     | fecha      | servicios                               |
+----+----------+-------------+----------+------------+-----------------------------------------+
|  1 | Juan     | De la torre | 10:30:00 | 2021-06-28 | Corte de Cabello Adulto, Corte de Barba |
| 10 | Joaquin  | Muñoz       | 19:00:00 | 2021-06-28 | Tratamiento Capilar                     |
| 14 | Ana      | Preciado    | 14:30:00 | 2021-06-28 | Corte de Cabello Mujer                  |
| 24 | Santiago | Hernandez   | 19:00:00 | 2021-06-28 | Corte de Cabello Niño                   |
| 26 | Miriam   | Dominguez   | 19:00:00 | 2021-06-28 | Corte de Cabello Niño                   |
| 28 | Hugo     | Alonso      | 09:00:00 | 2021-06-28 | Corte de Barba                          |
+----+----------+-------------+----------+------------+-----------------------------------------+
6 rows in set (0.00 sec)

mysql> SELECT * FROM reservaciones WHERE fecha = "2021-06-28" AND nombre = "Ana";
+----+--------+----------+----------+------------+------------------------+
| id | nombre | apellido | hora     | fecha      | servicios              |
+----+--------+----------+----------+------------+------------------------+
| 14 | Ana    | Preciado | 14:30:00 | 2021-06-28 | Corte de Cabello Mujer |
+----+--------+----------+----------+------------+------------------------+
1 row in set (0.00 sec)

mysql> SELECT * FROM reservaciones WHERE fecha = "2021-06-28" AND id IN(1,3);
+----+--------+-------------+----------+------------+-----------------------------------------+
| id | nombre | apellido    | hora     | fecha      | servicios                               |
+----+--------+-------------+----------+------------+-----------------------------------------+
|  1 | Juan   | De la torre | 10:30:00 | 2021-06-28 | Corte de Cabello Adulto, Corte de Barba |
+----+--------+-------------+----------+------------+-----------------------------------------+
1 row in set (0.00 sec)

mysql> SELECT * FROM reservaciones WHERE fecha = "2021-06-28" AND id IN(1,10);
+----+---------+-------------+----------+------------+-----------------------------------------+
| id | nombre  | apellido    | hora     | fecha      | servicios                               |
+----+---------+-------------+----------+------------+-----------------------------------------+
|  1 | Juan    | De la torre | 10:30:00 | 2021-06-28 | Corte de Cabello Adulto, Corte de Barba |
| 10 | Joaquin | Muñoz       | 19:00:00 | 2021-06-28 | Tratamiento Capilar                     |
+----+---------+-------------+----------+------------+-----------------------------------------+
2 rows in set (0.00 sec)

mysql>